{
  "version": 1,
  "package": "calcit.std",
  "package_version": "0.2.29",
  "definitions": [
    {
      "id": "calcit.std.hash/md5",
      "namespace": "calcit.std.hash",
      "name": "md5",
      "doc": "Calculate MD5 hash of a string.",
      "logical_schema": "(:: 'Fn ({} (:args ([] 'String)) (:return 'String)))",
      "signature": {
        "parameters": [
          {
            "position": 0,
            "type": { "kind": "string" }
          }
        ],
        "result": { "kind": "string" }
      },
      "lowering": {
        "backend": "native",
        "target": null,
        "kind": "pure-function",
        "symbol": "md5",
        "invoke": "sync",
        "transport": "edn-buffer-v1",
        "raw": "({} (:backend :native) (:invoke :sync) (:kind :pure-function) (:symbol |md5) (:transport :edn-buffer-v1))"
      },
      "status": "supported",
      "diagnostic_codes": []
    }
  ]
}
